{
  "$schema": "https://json-schema.org/draft/2020-12/schema",
  "$id": "https://dsh-desktop.local/specs/protocol/envelope.schema.json",
  "title": "ProtocolEnvelope",
  "type": "object",
  "additionalProperties": false,
  "$defs": {
    "requirement": {
      "type": "object",
      "additionalProperties": false,
      "required": [
        "coordinate",
        "required"
      ],
      "properties": {
        "coordinate": {
          "$ref": "protocol-coordinate.schema.json"
        },
        "required": {
          "type": "boolean"
        }
      }
    },
    "helloPayload": {
      "type": "object",
      "additionalProperties": false,
      "required": [
        "instanceId",
        "supports",
        "requires"
      ],
      "properties": {
        "instanceId": {
          "type": "string",
          "minLength": 8,
          "maxLength": 128
        },
        "supports": {
          "type": "array",
          "items": {
            "$ref": "protocol-coordinate.schema.json"
          },
          "uniqueItems": true
        },
        "requires": {
          "type": "array",
          "items": {
            "$ref": "#/$defs/requirement"
          },
          "uniqueItems": true
        }
      }
    },
    "unavailableCapability": {
      "type": "object",
      "additionalProperties": false,
      "required": [
        "coordinate",
        "reason"
      ],
      "properties": {
        "coordinate": {
          "$ref": "protocol-coordinate.schema.json"
        },
        "reason": {
          "enum": [
            "unavailable",
            "unsupported_version",
            "policy_denied",
            "provider_failed"
          ]
        }
      }
    },
    "agreementPayload": {
      "type": "object",
      "additionalProperties": false,
      "required": [
        "activationId",
        "granted",
        "unavailable"
      ],
      "properties": {
        "activationId": {
          "type": "string",
          "minLength": 1,
          "maxLength": 128
        },
        "granted": {
          "type": "array",
          "items": {
            "$ref": "protocol-coordinate.schema.json"
          },
          "uniqueItems": true
        },
        "unavailable": {
          "type": "array",
          "items": {
            "$ref": "#/$defs/unavailableCapability"
          },
          "uniqueItems": true
        },
        "leaseConstraints": {
          "type": "object",
          "additionalProperties": false,
          "properties": {
            "maxSeconds": {
              "type": "integer",
              "minimum": 1
            },
            "approvalRequired": {
              "type": "boolean"
            }
          }
        }
      }
    }
  },
  "required": [
    "protocol",
    "id",
    "kind",
    "participant",
    "timestamp",
    "generation"
  ],
  "properties": {
    "protocol": {
      "const": "interop.dsh-desktop.local/v1alpha1"
    },
    "id": {
      "type": "string",
      "minLength": 8,
      "maxLength": 128
    },
    "kind": {
      "enum": [
        "Hello",
        "Agreement",
        "Invocation",
        "Result",
        "Event"
      ]
    },
    "replyTo": {
      "type": "string",
      "minLength": 8,
      "maxLength": 128
    },
    "participant": {
      "type": "object",
      "additionalProperties": false,
      "required": [
        "component",
        "facet"
      ],
      "properties": {
        "component": {
          "type": "string",
          "minLength": 1
        },
        "facet": {
          "type": "string",
          "minLength": 1
        },
        "activationId": {
          "type": "string"
        }
      }
    },
    "timestamp": {
      "type": "string",
      "format": "date-time"
    },
    "generation": {
      "type": "integer",
      "minimum": 0
    },
    "capability": {
      "$ref": "protocol-coordinate.schema.json"
    },
    "method": {
      "type": "string",
      "pattern": "^[a-z][a-z0-9._-]+$"
    },
    "payload": {
      "type": "object"
    },
    "error": {
      "type": "object",
      "additionalProperties": false,
      "required": [
        "code",
        "message",
        "retryable",
        "correlationId"
      ],
      "properties": {
        "code": {
          "enum": [
            "UNAVAILABLE",
            "UNAUTHORIZED",
            "UNSUPPORTED_VERSION",
            "NOT_PROCESS_OWNER",
            "USER_GESTURE_REQUIRED",
            "USER_DENIED",
            "STALE_GENERATION",
            "MALFORMED_MESSAGE",
            "CONFLICT",
            "TIMEOUT",
            "SAFE_STOP"
          ]
        },
        "message": {
          "type": "string",
          "maxLength": 512
        },
        "retryable": {
          "type": "boolean"
        },
        "correlationId": {
          "type": "string",
          "minLength": 8,
          "maxLength": 128
        }
      }
    }
  },
  "allOf": [
    {
      "if": {
        "properties": {
          "kind": {
            "const": "Hello"
          }
        }
      },
      "then": {
        "required": [
          "payload"
        ],
        "properties": {
          "payload": {
            "$ref": "#/$defs/helloPayload"
          }
        },
        "not": {
          "anyOf": [
            {
              "required": [
                "replyTo"
              ]
            },
            {
              "required": [
                "capability"
              ]
            },
            {
              "required": [
                "method"
              ]
            },
            {
              "required": [
                "error"
              ]
            }
          ]
        }
      }
    },
    {
      "if": {
        "properties": {
          "kind": {
            "const": "Agreement"
          }
        }
      },
      "then": {
        "required": [
          "replyTo",
          "payload"
        ],
        "properties": {
          "payload": {
            "$ref": "#/$defs/agreementPayload"
          }
        },
        "not": {
          "anyOf": [
            {
              "required": [
                "capability"
              ]
            },
            {
              "required": [
                "method"
              ]
            },
            {
              "required": [
                "error"
              ]
            }
          ]
        }
      }
    },
    {
      "if": {
        "properties": {
          "kind": {
            "const": "Invocation"
          }
        }
      },
      "then": {
        "required": [
          "capability",
          "method",
          "payload"
        ],
        "not": {
          "anyOf": [
            {
              "required": [
                "replyTo"
              ]
            },
            {
              "required": [
                "error"
              ]
            }
          ]
        }
      }
    },
    {
      "if": {
        "properties": {
          "kind": {
            "const": "Result"
          }
        }
      },
      "then": {
        "required": [
          "replyTo",
          "capability",
          "method"
        ],
        "oneOf": [
          {
            "required": [
              "payload"
            ],
            "not": {
              "required": [
                "error"
              ]
            }
          },
          {
            "required": [
              "error"
            ],
            "not": {
              "required": [
                "payload"
              ]
            }
          }
        ]
      }
    },
    {
      "if": {
        "properties": {
          "kind": {
            "const": "Event"
          }
        }
      },
      "then": {
        "required": [
          "capability",
          "method",
          "payload"
        ],
        "not": {
          "required": [
            "error"
          ]
        }
      }
    }
  ]
}
