{
  "protocol": "interop.dsh-desktop.local/v1alpha1",
  "id": "msg-e9v8e7n6t5d4e3f2g1",
  "kind": "Event",
  "participant": {
    "component": "terminal-dsh-desktop-local",
    "facet": "pty-4f2k9d8a"
  },
  "timestamp": "2026-08-31T09:30:03.000Z",
  "generation": 1,
  "capability": {
    "apiVersion": "terminal.dsh-desktop.local/v1alpha1",
    "kind": "Terminal"
  },
  "method": "output",
  "payload": {
    "seq": 1,
    "data": "total 12\n"
  }
}
