{
  "protocol": "interop.dsh-desktop.local/v1alpha1",
  "id": "msg-r5e4s3u2l1t0d9e8f7",
  "kind": "Result",
  "participant": {
    "component": "terminal-dsh-desktop-local",
    "facet": "pty-4f2k9d8a"
  },
  "timestamp": "2026-08-31T09:30:02.120Z",
  "generation": 1,
  "replyTo": "msg-i4n3v2o1c9a8t7i6o5",
  "capability": {
    "apiVersion": "terminal.dsh-desktop.local/v1alpha1",
    "kind": "Terminal"
  },
  "method": "write",
  "payload": {
    "bytesWritten": 8
  }
}
